Title,Price,Details,URL
House for Sale in Gampaha,"Rs 3,900,000","Bedrooms: 3, Bathrooms: 1",https://ikman.lk/en/ad/house-for-sale-in-gampaha-for-sale-gampaha-2217
QUICK SALE:B/New 4/3BR House For Sale Canterbury Golf Resort Piliyandala,"Rs 32,000,000","Bedrooms: 4, Bathrooms: 3",https://ikman.lk/en/ad/quick-saleb-new-4-3br-house-for-sale-canterbury-golf-resort-piliyandala-for-sale-colombo-10
FEATURED,"Rs 41,000,000",+12,https://ikman.lk/en/ad/pdinci-novuu-nv-nivs-vikinniimtt-mhrgm-hndiyee-sitt-vinaaddi-8yi-for-sale-colombo
Hokandara Brand New Architecturally Disignd Two Storey House for Sale,"Rs 69,500,000","Bedrooms: 4, Bathrooms: 4",https://ikman.lk/en/ad/hokandara-brand-new-architecturally-disignd-two-storey-house-for-sale-for-sale-colombo
Bokundara Architecture Designed Super Luxury Two Story House For Sale,"Rs 41,500,000","Bedrooms: 4, Bathrooms: 3",https://ikman.lk/en/ad/bokundara-architecture-designed-super-luxury-two-story-house-for-sale-for-sale-colombo
Piliyandala Architecture Designed Super Luxury Three Story House,"Rs 37,500,000","Bedrooms: 5, Bathrooms: 3",https://ikman.lk/en/ad/piliyandala-architecture-designed-super-luxury-three-story-house-for-sale-colombo
Newly Build Three Story House for Sale Jayaliyagama,"Rs 43,000,000","Bedrooms: 4, Bathrooms: 3",https://ikman.lk/en/ad/newly-build-three-story-house-for-sale-jayaliyagama-for-sale-colombo
Newly Build Single Story House For Sale,"Rs 23,500,000","Bedrooms: 2, Bathrooms: 1",https://ikman.lk/en/ad/newly-build-single-story-house-for-sale-for-sale-colombo-12
Super Luxury Two Story House for Sale Kesbewa,"Rs 55,000,000","Bedrooms: 4, Bathrooms: 4",https://ikman.lk/en/ad/super-luxury-two-story-house-for-sale-kesbewa-for-sale-colombo
Brand New Two Story House for Sale Rajagiriya,"Rs 172,000,000","Bedrooms: 5, Bathrooms: 4",https://ikman.lk/en/ad/brand-new-two-story-house-for-sale-rajagiriya-for-sale-colombo
Newly Build Two Story House for Sale Mattegoda,"Rs 51,000,000","Bedrooms: 5, Bathrooms: 4",https://ikman.lk/en/ad/newly-build-two-story-house-for-sale-mattegoda-for-sale-colombo-1
Newly Build Luxury Two Story House For Sale Kesbewa,"Rs 69,500,000","Bedrooms: 5, Bathrooms: 4",https://ikman.lk/en/ad/newly-build-luxury-two-story-house-for-sale-kesbewa-for-sale-colombo
Newly Build Luxury Three Story House For Sale Pelawatta,"Rs 69,500,000","Bedrooms: 4, Bathrooms: 3",https://ikman.lk/en/ad/newly-build-luxury-three-story-house-for-sale-pelawatta-for-sale-colombo
"Luxury Residence for Sale – Nugegoda, Colombo","Rs 85,000,000","Bedrooms: 4, Bathrooms: 4",https://ikman.lk/en/ad/luxury-residence-for-sale-nugegoda-colombo-for-sale-colombo-3
"Sitting, Dining, 2 Living Area Brand New Story House For Sale Negombo","Rs 47,500,000","Bedrooms: 4, Bathrooms: 3",https://ikman.lk/en/ad/sitting-dining-2-living-area-brand-new-story-house-for-sale-negombo-for-sale-gampaha-22
Brand New Single Storey House For Sale in Athurugiriya,"Rs 24,500,000","Bedrooms: 3, Bathrooms: 2",https://ikman.lk/en/ad/brand-new-single-storey-house-for-sale-in-athurugiriya-for-sale-colombo-42
Single Storey House for Sale in Rajagiriya Kalapaluwawa Ds328,"Rs 32,000,000","Bedrooms: 2, Bathrooms: 2",https://ikman.lk/en/ad/single-storey-house-for-sale-in-rajagiriya-kalapaluwawa-ds328-for-sale-colombo-1
"House for Sale in Panadura, Mandawala","Rs 22,500,000","Bedrooms: 4, Bathrooms: 1",https://ikman.lk/en/ad/house-for-sale-in-panadura-mandawala-for-sale-kalutara
Two Storey House with 9P Land for Sale Dehiwala,"Rs 65,000,000","Bedrooms: 5, Bathrooms: 3",https://ikman.lk/en/ad/two-storey-house-with-9p-land-for-sale-dehiwala-for-sale-colombo
Single Storey House for Sale in Rajagiriya Ds1755,"Rs 67,000,000","Bedrooms: 3, Bathrooms: 2",https://ikman.lk/en/ad/single-storey-house-for-sale-in-rajagiriya-ds1755-for-sale-colombo-2
House in Bokundara Thumbowila Piliyandala 220,"Rs 22,000,000","Bedrooms: 3, Bathrooms: 1",https://ikman.lk/en/ad/house-in-bokundara-thumbowila-piliyandala-220-for-sale-colombo
Land for Sale Nawala DS8000,"Rs 55,000,000","Bedrooms: 4, Bathrooms: 4",https://ikman.lk/en/ad/land-for-sale-nawala-ds8000-for-sale-colombo-5
Brand-New modern House From Katubedda Moratuwa - 500 m to Galle Rd,"Rs 68,500,000","Bedrooms: 4, Bathrooms: 4",https://ikman.lk/en/ad/brand-new-modern-house-from-katubedda-moratuwa-500-m-to-galle-rd-for-sale-colombo
2 Storied House for sale in Kadawatha with 13.5 p,"Rs 42,500,000","Bedrooms: 4, Bathrooms: 3",https://ikman.lk/en/ad/2-storied-house-for-sale-in-kadawatha-with-135-p-for-sale-gampaha
Newly House for Sale in Mount Lavenia,"Rs 99,500,000","Bedrooms: 5, Bathrooms: 6",https://ikman.lk/en/ad/newly-house-for-sale-in-mount-lavenia-for-sale-colombo-2
Modern House for Sale in Thalawathugoda,"Rs 56,000,000","Bedrooms: 4, Bathrooms: 3",https://ikman.lk/en/ad/modern-house-for-sale-in-thalawathugoda-for-sale-colombo-917
95M - Luxury House for Sale Thalawathugoda,"Rs 95,000,000","Bedrooms: 4, Bathrooms: 5",https://ikman.lk/en/ad/95m-luxury-house-for-sale-thalawathugoda-for-sale-colombo
Brand New Single Storey Modern House for Sale,"Rs 39,500,000","Bedrooms: 3, Bathrooms: 2",https://ikman.lk/en/ad/brand-new-single-storey-modern-house-for-sale-for-sale-colombo-1
Fully completed House with 17 p for Sale Panadura,"Rs 29,500,000","Bedrooms: 3, Bathrooms: 2",https://ikman.lk/en/ad/fully-completed-house-with-17-p-for-sale-panadura-for-sale-kalutara
අගනා නිවසක් විකිණීමට මිල්ලනිය,"Rs 5,500,000","Bedrooms: 3, Bathrooms: 1",https://ikman.lk/en/ad/agnaa-nivsk-vikinniimtt-millniy-for-sale-kalutara
FEATURED,"Rs 39,500,000",+12,https://ikman.lk/en/ad/brand-new-luxury-house-for-sale-kahathuduwa-residencies-for-sale-colombo
Modern Architect-Designed Single Storey House for Sale – Diyagama,"Rs 23,000,000","Bedrooms: 3, Bathrooms: 2",https://ikman.lk/en/ad/modern-architect-designed-single-storey-house-for-sale-diyagama-for-sale-colombo
Brand New Architecturally Designed Two Storey House for Sale in Kottawa,"Rs 54,000,000","Bedrooms: 4, Bathrooms: 3",https://ikman.lk/en/ad/brand-new-architecturally-designed-two-storey-house-for-sale-in-kottawa-for-sale-colombo
Super Luxury House for Sale with Furniture,"Rs 56,000,000","Bedrooms: 4, Bathrooms: 3",https://ikman.lk/en/ad/super-luxury-house-for-sale-with-furniture-for-sale-colombo-2
Brand New Two Storey House for Sale Kottawa,"Rs 51,000,000","Bedrooms: 4, Bathrooms: 3",https://ikman.lk/en/ad/brand-new-two-storey-house-for-sale-kottawa-for-sale-colombo-12
Luxury House for Sale in Battaramulla [HS102],"Rs 105,000,000","Bedrooms: 7, Bathrooms: 7",https://ikman.lk/en/ad/luxury-house-for-sale-in-battaramulla-hs102-for-sale-colombo-15
"Bulathkohupitiya – 750m to Town, Main Road Facing House for Sale","Rs 14,900,000","Bedrooms: 4, Bathrooms: 1",https://ikman.lk/en/ad/bulathkohupitiya-750m-to-town-main-road-facing-house-for-sale-for-sale-kegalle
Luxuy House for Sale in Mount Lavania,"Rs 135,000,000","Bedrooms: 6, Bathrooms: 4",https://ikman.lk/en/ad/luxuy-house-for-sale-in-mount-lavania-for-sale-colombo-1
අඩක් නිමකර දෙමහල් නිවසක් විකිණීමට,"Rs 9,400,000","Bedrooms: 4, Bathrooms: 2",https://ikman.lk/en/ad/addk-nimkr-demhl-nivsk-vikinniimtt-for-sale-gampaha-1
Luxury House for Sale Thalawathugoda,"Rs 95,000,000","Bedrooms: 4, Bathrooms: 4",https://ikman.lk/en/ad/luxury-house-for-sale-thalawathugoda-for-sale-colombo-459
Angoda පර්චස් 13ක නිවස විකිණීමට,"Rs 16,000,000","Bedrooms: 3, Bathrooms: 1",https://ikman.lk/en/ad/prcs-13k-iddm-smg-nivs-vikinniimtt-aet-for-sale-colombo
single house for sale in nawala Ds24,"Rs 35,000,000","Bedrooms: 2, Bathrooms: 2",https://ikman.lk/en/ad/single-house-for-sale-in-nawala-ds24-for-sale-colombo-2
super elegant luxury house for sale nawala Ds 20175,"Rs 175,000,000","Bedrooms: 4, Bathrooms: 3",https://ikman.lk/en/ad/super-elegant-luxury-house-for-sale-nawala-ds-20175-for-sale-colombo-2
අලුතෙන්ම ඉදිකරන ලද වටිනා තනිමහල් නිවසක් කොට්ටාව අදිවේගී පිවිසුම(09162na),"Rs 29,500,000","Bedrooms: 3, Bathrooms: 2",https://ikman.lk/en/ad/alutenm-idikrn-ld-vttinaa-tnimhl-nivsk-kottttaav-adiveegii-pivisum09162na-for-sale-colombo
"Beautiful New House for Sale in Wickramasingha Pura, Battaramulla","Rs 32,000,000","Bedrooms: 3, Bathrooms: 2",https://ikman.lk/en/ad/beautiful-new-house-for-sale-in-wickramasingha-pura-battaramulla-for-sale-colombo-1
Uncommon Architect Design Tow Story House For Sale in Vidyala Junction,"Rs 34,000,000","Bedrooms: 5, Bathrooms: 3",https://ikman.lk/en/ad/uncommon-architect-design-tow-story-house-for-sale-in-vidyala-junction-for-sale-colombo
Very Beautiful three-storey House For Sale in Rajamaha Vihars Rd Nawinna,"Rs 59,500,000","Bedrooms: 6, Bathrooms: 5",https://ikman.lk/en/ad/very-beautiful-three-storey-house-for-sale-in-rajamaha-vihars-rd-nawinna-for-sale-colombo
Exclusive Luxury Two-Story House for Sale – Near Parliament.[HS100],"Rs 100,000,000","Bedrooms: 4, Bathrooms: 3",https://ikman.lk/en/ad/exclusive-luxury-two-story-house-for-sale-near-parliamenths100-for-sale-colombo-40
Pannipitiya Near to Railway Station House for Sale,"Rs 75,000,000","Bedrooms: 5, Bathrooms: 3",https://ikman.lk/en/ad/pannipitiya-near-to-railway-station-house-for-sale-for-sale-colombo-3
Brand-New Modern House With Unique Architecture - Piliyandala Madapatha,"Rs 27,000,000","Bedrooms: 3, Bathrooms: 2",https://ikman.lk/en/ad/brand-new-modern-house-with-unique-architecture-piliyandala-madapatha-for-sale-colombo
Kottawata 30M House for Sale.,"Rs 37,500,000","Bedrooms: 5, Bathrooms: 3",https://ikman.lk/en/ad/kottawata-30m-house-for-sale-for-sale-colombo-1
(DH1119) Luxury Three Storey House for Sale in Mattegoda Prime Aurora,"Rs 34,500,000","Bedrooms: 3, Bathrooms: 2",https://ikman.lk/en/ad/dh1119-luxury-three-storey-house-for-sale-in-mattegoda-prime-aurora-for-sale-colombo
3 Story House For Sale With Roof Top In Kottawa,"Rs 54,000,000","Bedrooms: 5, Bathrooms: 3",https://ikman.lk/en/ad/3-story-house-for-sale-with-roof-top-in-kottawa-for-sale-colombo
රාගම වල්පොල නිවසක් විකිණීමට,"Rs 3,900,000","Bedrooms: 2, Bathrooms: 1",https://ikman.lk/en/ad/raagm-vlpol-nivsk-vikinniimtt-for-sale-gampaha
Brand New House for Sale in Malabe,"Rs 78,000,000","Bedrooms: 6, Bathrooms: 5",https://ikman.lk/en/ad/brand-new-house-for-sale-in-malabe-for-sale-colombo-1501
Thalawathugoda Gated Community 10.5 Perch 5BR A/C Luxury House For Sale,"Rs 51,000,000","Bedrooms: 5, Bathrooms: 4",https://ikman.lk/en/ad/thalawathugoda-gated-community-105-perch-5br-a-c-luxury-house-for-sale-for-sale-colombo-1
House for Sale in Piduruwalla,"Rs 25,000,000","Bedrooms: 4, Bathrooms: 3",https://ikman.lk/en/ad/house-for-sale-for-sale-kurunegala-2145
Two-Storey House for Sale Hokandara Thalawathugoda,"Rs 29,750,000","Bedrooms: 3, Bathrooms: 2",https://ikman.lk/en/ad/two-storey-house-for-sale-hokandara-thalawathugoda-for-sale-colombo
FEATURED,"Rs 29,750,000",+12,https://ikman.lk/en/ad/two-storey-house-for-sale-hokandara-thalawathugoda-for-sale-colombo
කොට්ටාවෙන් අංග සම්පූර්ණ නිවසක් විකිණීමට,"Rs 37,500,000","Bedrooms: 5, Bathrooms: 3",https://ikman.lk/en/ad/kottttaaven-ang-smpuurnn-nivsk-vikinniimtt-for-sale-colombo-2
BRAND NEW SINGLE HOUSE FOR SALE IN KOTTAWA,"Rs 19,000,000","Bedrooms: 3, Bathrooms: 2",https://ikman.lk/en/ad/brand-new-single-house-for-sale-in-kottawa-for-sale-colombo-97
Modern 3BR Luxury House for Sale in Athurugiriya – 2km to Highway,"Rs 23,000,000","Bedrooms: 3, Bathrooms: 3",https://ikman.lk/en/ad/modern-3br-luxury-house-for-sale-in-athurugiriya-2km-to-highway-for-sale-colombo
Modern Designed Brand New House for Sale Mount Lavinia,"Rs 105,000,000","Bedrooms: 5, Bathrooms: 6",https://ikman.lk/en/ad/modern-designed-brand-new-house-for-sale-mount-lavinia-for-sale-colombo-2
Malabe Two Story House for Sale,"Rs 38,000,000","Bedrooms: 4, Bathrooms: 2",https://ikman.lk/en/ad/malabe-two-story-house-for-sale-for-sale-colombo-3
House for Sale Piliyandala/kesbewa 20p Land,"Rs 24,500,000","Bedrooms: 3, Bathrooms: 2",https://ikman.lk/en/ad/house-for-sale-piliyandala-kesbewa-20p-land-for-sale-colombo-1
House for Sale in Panadura,"Rs 70,000,000","Bedrooms: 5, Bathrooms: 3",https://ikman.lk/en/ad/house-for-sale-in-panadura-for-sale-kalutara-2345
House for Sale in Mount Lavinia,"Rs 98,000,000","Bedrooms: 5, Bathrooms: 3",https://ikman.lk/en/ad/house-for-sale-in-mount-lavinia-for-sale-colombo-1222
Perfect Built Royal Luxury 4 Br Upstairs New House For Sale In Negombo,"Rs 47,500,000","Bedrooms: 4, Bathrooms: 3",https://ikman.lk/en/ad/perfect-built-royal-luxury-4-br-upstairs-new-house-for-sale-in-negombo-for-sale-gampaha
𝗛𝗢𝗨𝗦𝗘 𝗙𝗢𝗥 𝗦𝗔𝗟𝗘 – 𝗧𝗛𝗔𝗟𝗔𝗛𝗘𝗡𝗔,"Rs 44,500,000","Bedrooms: 5, Bathrooms: 5",https://ikman.lk/en/ad/for-sale-colombo-3982
House For Sale In Gampaha,"Rs 145,000,000","Bedrooms: 6, Bathrooms: 4",https://ikman.lk/en/ad/house-for-sale-in-gampaha-for-sale-gampaha-2218
New House for Sale in Wattala ( Enderamulla ),"Rs 33,000,000","Bedrooms: 3, Bathrooms: 2",https://ikman.lk/en/ad/new-house-for-sale-in-wattala-enderamulla-for-sale-gampaha-27
House for Sale Piliyandala with 20p Land,"Rs 24,500,000","Bedrooms: 3, Bathrooms: 2",https://ikman.lk/en/ad/house-for-sale-piliyandala-with-20p-land-for-sale-colombo
New Luxury House for Sale - Kandana,"Rs 69,000,000","Bedrooms: 4, Bathrooms: 4",https://ikman.lk/en/ad/new-luxury-house-for-sale-kandana-for-sale-gampaha-2
Boralesgamuwa Dream Family Home,"Rs 65,000,000","Bedrooms: 5, Bathrooms: 5",https://ikman.lk/en/ad/boralesgamuwa-dream-family-home-for-sale-colombo
Premium Family Home in Nedimala – Lift Garage,"Rs 180,000,000","Bedrooms: 4, Bathrooms: 4",https://ikman.lk/en/ad/premium-family-home-in-nedimala-lift-garage-for-sale-colombo
House for Sale in Rathnapura,"Rs 32,500,000","Bedrooms: 2, Bathrooms: 1",https://ikman.lk/en/ad/house-for-sale-in-rathnapurartnpur-paandura8-prdhaan-paartt-muhunnlaa-for-sale-ratnapura
Single storied|House for sale in wadduwa,"Rs 17,000,000","Bedrooms: 3, Bathrooms: 1",https://ikman.lk/en/ad/single-storiedhouse-for-sale-in-wadduwa-for-sale-kalutara-6
House for Sale Minuwangoda,"Rs 18,500,000","Bedrooms: 2, Bathrooms: 1",https://ikman.lk/en/ad/big-city-for-sale-gampaha
House for Sale in Kurunegala,"Rs 12,900,000","Bedrooms: 4, Bathrooms: 2",https://ikman.lk/en/ad/house-for-sale-in-kurunegala-for-sale-kurunegala-1695
House with Land for Sale Batticaola,"Rs 9,000,000","Bedrooms: 3, Bathrooms: 2",https://ikman.lk/en/ad/land-and-house-coconut-trees-for-sale-for-sale-batticaloa
House for Sale in Panadura,"Rs 57,500,000","Bedrooms: 4, Bathrooms: 2",https://ikman.lk/en/ad/house-for-sale-in-panadura-for-sale-kalutara-2342
House Sale in Galle,"Rs 38,500,000","Bedrooms: 3, Bathrooms: 2",https://ikman.lk/en/ad/house-sale-in-galle-for-sale-galle-6
House Sale Kaduwela,"Rs 15,900,000","Bedrooms: 2, Bathrooms: 2",https://ikman.lk/en/ad/house-sale-kaduwela-for-sale-colombo
Homagama Luxury House for Sale,Rs 460,"Bedrooms: 5, Bathrooms: 3",https://ikman.lk/en/ad/homagama-luxury-house-for-sale-for-sale-colombo
Prime Clover – Luxury Living in Thalawathugoda,"Rs 84,000,000","Bedrooms: 4, Bathrooms: 3",https://ikman.lk/en/ad/prime-clover-luxury-living-in-thalawathugoda-for-sale-colombo-12
FEATURED,"Rs 310,000,000",+17,https://ikman.lk/en/ad/architecture-designed-furnished-luxury-house-for-sale-in-pelawatta-for-sale-colombo
Investment Property,"Rs 16,500,000","Bedrooms: 3, Bathrooms: 2",https://ikman.lk/en/ad/investment-property-for-sale-gampaha-1
"Home for Sale in Yakkala,Gampaha M226","Rs 29,700,000","Bedrooms: 4, Bathrooms: 3",https://ikman.lk/en/ad/home-for-sale-in-yakkalagampaha-m226-for-sale-kandy
Brand New House for Sale in Athurugiriya,"Rs 39,000,000","Bedrooms: 3, Bathrooms: 2",https://ikman.lk/en/ad/brand-new-house-for-sale-in-athurugiriya-for-sale-colombo-2282
03-Storied Luxury House for Sale Piliyandala,"Rs 42,000,000","Bedrooms: 6, Bathrooms: 5",https://ikman.lk/en/ad/03-storied-luxury-house-for-sale-piliyandala-for-sale-colombo-1
Well Build Two Storied House In Talawatugoda,"Rs 56,000,000","Bedrooms: 4, Bathrooms: 3",https://ikman.lk/en/ad/well-build-two-storied-house-in-talawatugoda-for-sale-colombo
Luxury House Sale Athurugiriya,"Rs 36,000,000","Bedrooms: 5, Bathrooms: 3",https://ikman.lk/en/ad/luxury-house-sale-athurugiriya-for-sale-colombo
House for Sale kurunegala,"Rs 7,800,000","Bedrooms: 2, Bathrooms: 1",https://ikman.lk/en/ad/house-for-sale-kurunegala-for-sale-kurunegala-484
"House for Sale in Devika Garden, Colombo 05","Rs 160,000,000","Bedrooms: 4, Bathrooms: 3",https://ikman.lk/en/ad/house-for-sale-in-devika-garden-colombo-05-for-sale-colombo-1
3 Bedrooms House for Sale in Piliyandala Town,"Rs 19,500,000","Bedrooms: 3, Bathrooms: 2",https://ikman.lk/en/ad/3-bedrooms-house-for-sale-in-piliyandala-town-for-sale-colombo-3
"Spacious 4-Bedroom House for Sale – Thalawathugoda, Kalalgoda","Rs 65,000,000","Bedrooms: 4, Bathrooms: 4",https://ikman.lk/en/ad/spacious-4-bedroom-house-for-sale-thalawathugoda-kalalgoda-for-sale-colombo-8
Malabe House for Sale,"Rs 37,500,000","Bedrooms: 5, Bathrooms: 3",https://ikman.lk/en/ad/malabe-house-for-sale-for-sale-colombo-251
Brand New House For Sale in Kadawatha | Weboda,"Rs 23,500,000","Bedrooms: 3, Bathrooms: 2",https://ikman.lk/en/ad/brand-new-house-for-sale-in-kadawatha-weboda-for-sale-gampaha
පොල්ගහවෙල බඹරගල පන්සල අසල – නිවස සහිත පර්චස් 23 ඉඩම,"Rs 9,800,000","Bedrooms: 3, Bathrooms: 2",https://ikman.lk/en/ad/polghvel-bmbrgl-pnsl-asl-nivs-shit-prcs-23-iddm-for-sale-kurunegala
ගාල්ල වලහන්දූව නිවසක් ඉඩම සමඟ විකිනීමට,"Rs 3,800,000","Bedrooms: 2, Bathrooms: 1",https://ikman.lk/en/ad/gaall-vlhnduuv-nivsk-iddm-smnng-vikiniimtt-for-sale-galle
"Modern Two-Storey Luxury Home for Sale – Polgasowita, Piliyandala","Rs 34,500,000","Bedrooms: 3, Bathrooms: 2",https://ikman.lk/en/ad/modern-two-storey-luxury-home-for-sale-polgasowita-piliyandala-for-sale-colombo-12
Modern 5-Bed Home with Garden – Arangala,"Rs 62,500,000","Bedrooms: 5, Bathrooms: 4",https://ikman.lk/en/ad/modern-5-bed-home-with-garden-arangala-for-sale-colombo
Brand New Luxury House for Sale in Minuwangoda,"Rs 37,500,000","Bedrooms: 4, Bathrooms: 3",https://ikman.lk/en/ad/brand-new-luxury-house-for-sale-in-minuwangoda-for-sale-gampaha-1
House for Sale Ragama,"Rs 25,000,000","Bedrooms: 7, Bathrooms: 5",https://ikman.lk/en/ad/house-for-sale-ragama-for-sale-gampaha-670
Canterbury Golf Brand New 3BR House For Sale in Piliyandala - EH373,"Rs 32,000,000","Bedrooms: 3, Bathrooms: 2",https://ikman.lk/en/ad/canterbury-golf-brand-new-3br-house-for-sale-in-piliyandala-eh373-for-sale-colombo-9
House For Sale in Dompe,"Rs 16,500,000","Bedrooms: 3, Bathrooms: 2",https://ikman.lk/en/ad/house-for-sale-in-dompe-for-sale-gampaha-2
House for Sale in Mount Lavinia (C7-9667),"Rs 60,000,000","Bedrooms: 7, Bathrooms: 4",https://ikman.lk/en/ad/house-for-sale-in-mount-lavinia-c7-9667-for-sale-colombo
Single Storey Brand New House in Piliyandala. Gated Community,"Rs 24,000,000","Bedrooms: 3, Bathrooms: 2",https://ikman.lk/en/ad/single-storey-brand-new-house-in-piliyandala-gated-community-for-sale-colombo
Valuable House for Sale Athurugiriya,"Rs 8,933,000","Bedrooms: 3, Bathrooms: 2",https://ikman.lk/en/ad/valuable-house-for-sale-athurugiriya-for-sale-colombo-61
Full Complete New House For Sale in Negombo,"Rs 22,000,000","Bedrooms: 3, Bathrooms: 2",https://ikman.lk/en/ad/full-complete-new-house-for-sale-in-negombo-for-sale-gampaha-7
House for Sale in Kotte – Madiwela,"Rs 35,000,000","Bedrooms: 3, Bathrooms: 2",https://ikman.lk/en/ad/house-for-sale-in-kotte-madiwela-for-sale-colombo-5
House for Sale in Negambo (C7-9663),"Rs 120,000,000","Bedrooms: 8, Bathrooms: 8",https://ikman.lk/en/ad/house-for-sale-in-negambo-c7-9663-for-sale-gampaha
House for Sale in Katubedda,"Rs 38,000,000","Bedrooms: 5, Bathrooms: 3",https://ikman.lk/en/ad/house-for-sale-in-katubedda-for-sale-colombo-333
"Prime House – Gated Community,Athurugiriya","Rs 24,000,000","Bedrooms: 3, Bathrooms: 2",https://ikman.lk/en/ad/prime-house-gated-communityathurugiriya-for-sale-colombo
"Luxury 3-Bed Residence – Milaniyam City ,Athurugiriya","Rs 35,000,000","Bedrooms: 3, Bathrooms: 3",https://ikman.lk/en/ad/luxury-3-bed-residence-milaniyam-city-athurugiriya-for-sale-colombo
Modern Single Storey Home – Athurugiriya,"Rs 23,000,000","Bedrooms: 3, Bathrooms: 3",https://ikman.lk/en/ad/modern-single-storey-home-athurugiriya-for-sale-colombo-1
Modern 3-Storey House Near Millennium City,"Rs 43,000,000","Bedrooms: 4, Bathrooms: 3",https://ikman.lk/en/ad/modern-3-storey-house-near-millennium-city-for-sale-colombo
Modern Single Storey House for Sale – Athurugiriya,"Rs 27,500,000","Bedrooms: 3, Bathrooms: 2",https://ikman.lk/en/ad/modern-single-storey-house-for-sale-athurugiriya-for-sale-colombo-21
Hot Property Alert – Stylish House in Athurugiriya,"Rs 32,000,000","Bedrooms: 4, Bathrooms: 3",https://ikman.lk/en/ad/hot-property-alert-stylish-house-in-athurugiriya-for-sale-colombo
dehiwala house for sale in with furnitured,"Rs 180,000,000","Bedrooms: 4, Bathrooms: 4",https://ikman.lk/en/ad/dehiwala-house-for-sale-in-with-furnitured-for-sale-colombo
5 Bed House for sale in Wellawatha (C7-9658),"Rs 320,000,000","Bedrooms: 5, Bathrooms: 5",https://ikman.lk/en/ad/5-bed-house-for-sale-in-wellawatha-c7-9658-for-sale-colombo
Brand New Two-Storey House in Malabe,"Rs 34,500,000","Bedrooms: 3, Bathrooms: 3",https://ikman.lk/en/ad/brand-new-two-storey-house-in-malabe-for-sale-colombo-24
Modern 4-Bedroom House for Sale in Malabe – Prime Residential Location,"Rs 49,500,000","Bedrooms: 4, Bathrooms: 3",https://ikman.lk/en/ad/modern-4-bedroom-house-for-sale-in-malabe-prime-residential-location-for-sale-colombo-54
නයිවලින් පර්චස් 42ක ඉඩම සමග නිවාස දෙකක්,"Rs 15,800,000","Bedrooms: 6, Bathrooms: 2",https://ikman.lk/en/ad/nyivlin-prcs-42k-iddm-smg-nivaas-dekk-for-sale-gampaha
2 Storied House Fir Sale in Bokundara,"Rs 29,000,000","Bedrooms: 4, Bathrooms: 2",https://ikman.lk/en/ad/2-storied-house-fir-sale-in-bokundara-for-sale-colombo
Athurugiriya Brand-New Single-Story Family Home with Modern Amenities,"Rs 32,500,000","Bedrooms: 3, Bathrooms: 3",https://ikman.lk/en/ad/athurugiriya-brand-new-single-story-family-home-with-modern-amenities-for-sale-colombo
2 Story House For Sale In Kottawa - CH1524,"Rs 32,500,000","Bedrooms: 3, Bathrooms: 2",https://ikman.lk/en/ad/2-story-house-for-sale-in-kottawa-ch1524-for-sale-colombo-13
Luxury House for Sale in Kumbuka,"Rs 26,500,000","Bedrooms: 3, Bathrooms: 2",https://ikman.lk/en/ad/luxury-house-for-sale-in-kumbuka-for-sale-colombo-6
කදාන–ගනේමුල්ල පාරට මීටර් 50ක් පමණ ආසන්නව නිවසක්,"Rs 15,300,000","Bedrooms: 3, Bathrooms: 2",https://ikman.lk/en/ad/kdaan-gneemull-paartt-miittr-50k-pmnn-aasnnv-nivsk-for-sale-gampaha
Brand-New Luxury 2-Story House for Sale – Battaramulla,"Rs 95,000,000","Bedrooms: 4, Bathrooms: 4",https://ikman.lk/en/ad/brand-new-luxury-2-story-house-for-sale-battaramulla-for-sale-colombo-20
3 Beds house sale in Seeduwa,"Rs 8,500,000","Bedrooms: 3, Bathrooms: 1",https://ikman.lk/en/ad/3-beds-house-sale-in-seeduwa-for-sale-gampaha-2
Near Panadura Town 300m House for Sale,"Rs 45,000,000","Bedrooms: 3, Bathrooms: 2",https://ikman.lk/en/ad/near-panadura-town-300m-house-for-sale-for-sale-kalutara
House for Sale in Kalagediena,"Rs 18,500,000","Bedrooms: 3, Bathrooms: 1",https://ikman.lk/en/ad/house-for-sale-in-kalagediena-for-sale-gampaha-1
Luxury Brand New House For Sale Malabe,"Rs 62,500,000","Bedrooms: 5, Bathrooms: 4",https://ikman.lk/en/ad/luxury-brand-new-house-for-sale-malabe-for-sale-colombo-5
"Luxury House Sale Pannipitiya, Maharagama. (ID: ANDH001A)","Rs 43,900,000","Bedrooms: 2, Bathrooms: 3",https://ikman.lk/en/ad/luxury-house-sale-pannipitiya-maharagama-id-andh001a-for-sale-colombo-1
FEATURED,"Rs 57,500,000",+17,https://ikman.lk/en/ad/house-for-sale-in-panadura-for-sale-kalutara-2342
Luxurious Two Story 6 Br House for Sale in Thalawathugoda,"Rs 70,000,000","Bedrooms: 6, Bathrooms: 4",https://ikman.lk/en/ad/luxurious-two-story-6-br-house-for-sale-in-thalawathugoda-for-sale-colombo
House for Sale in Malabe,"Rs 50,000,000","Bedrooms: 4, Bathrooms: 3",https://ikman.lk/en/ad/house-for-sale-in-malabe-for-sale-colombo-3706
House for sale in Piliyandala,"Rs 35,000,000","Bedrooms: 3, Bathrooms: 2",https://ikman.lk/en/ad/house-for-sale-in-piliyandala-for-sale-colombo-8158
House for sale in Kottawa,"Rs 54,000,000","Bedrooms: 7, Bathrooms: 6",https://ikman.lk/en/ad/house-for-sale-in-kottawa-for-sale-colombo-2526
House for sale in Rathmalana,"Rs 50,000,000","Bedrooms: 3, Bathrooms: 3",https://ikman.lk/en/ad/house-for-sale-in-rathmalana-for-sale-colombo-505
House for sale in Colombo 05,"Rs 50,000,000","Bedrooms: 5, Bathrooms: 3",https://ikman.lk/en/ad/house-for-sale-in-colombo-05-for-sale-colombo-376
House for Sale in Kesbewa ( Polgasowita ),"Rs 23,000,000","Bedrooms: 4, Bathrooms: 3",https://ikman.lk/en/ad/house-for-sale-in-kesbewa-polgasowita-for-sale-colombo
House for sale in Moratuva,"Rs 55,000,000","Bedrooms: 5, Bathrooms: 3",https://ikman.lk/en/ad/house-for-sale-in-moratuva-for-sale-colombo-19
House for sale in warakapola,"Rs 8,400,000","Bedrooms: 2, Bathrooms: 1",https://ikman.lk/en/ad/house-for-sale-in-warakapola-for-sale-kegalle-76
